### ISSUE TITLE
handshake fail with "Alert (Level: Fatal, Description: Protocol Version)"

### ISSUE THREAD

**Issue by BaichengAutel** [Mbed-TLS/mbedtls#10141]
### Summary
handshake with 1.2 and 1.3, fail after client hello, and receive "Alert (Level: Fatal, Description: Protocol Version)"

message flow is:
**msg1：**
Frame 1616: 165 bytes on wire (1320 bits), 165 bytes captured (1320 bits)
Ethernet II, Src: d6:1a:53:62:78:00 (d6:1a:53:62:78:00), Dst: d6:1a:53:21:78:00 (d6:1a:53:21:78:00)
Internet Protocol Version 4, Src: 4.232.99.1, Dst: 10.200.33.18
Transmission Control Protocol, Src Port: 443, Dst Port: 40942, Seq: 1, Ack: 470, Len: 99
Transport Layer Security
    TLSv1.3 Record Layer: Handshake Protocol: Hello Retry Request
        Content Type: Handshake (22)
        Version: TLS 1.2 (0x0303)
        Length: 88
        Handshake Protocol: Hello Retry Request
            Handshake Type: Server Hello (2)
            Length: 84
            Version: TLS 1.2 (0x0303)
            Random: cf21ad74e59a6111be1d8c021e65b891c2a211167abb8c5e079e09e2c8a8339c (HelloRetryRequest magic)
            Session ID Length: 32
            Session ID: 7b5c94253134a6efc0120ce69c54074a49bc8d5bdb1dd4395584f1c1e263e47e
            Cipher Suite: TLS_AES_256_GCM_SHA384 (0x1302)
            Compression Method: null (0)
            Extensions Length: 12
            Extension: supported_versions (len=2) TLS 1.3
                Type: supported_versions (43)
                Length: 2
                Supported Version: TLS 1.3 (0x0304)
            Extension: key_share (len=2) secp521r1
                Type: key_share (51)
                Length: 2
                Key Share extension
                    Selected Group: secp521r1 (25)
            [JA3S Fullstring: 771,4866,43-51]
            [JA3S: 15af977ce25de452b96affa2addb1036]
    TLSv1.3 Record Layer: Change Cipher Spec Protocol: Change Cipher Spec
        Content Type: Change Cipher Spec (20)
        Version: TLS 1.2 (0x0303)
        Length: 1
        Change Cipher Spec Message

1619	2025-04-17 18:50:19.750208	10.200.33.18	4.232.99.1	TLSv1.3	72	Change Cipher Spec

**msg2：**
Frame 1619: 72 bytes on wire (576 bits), 72 bytes captured (576 bits)
Ethernet II, Src: d6:1a:53:21:78:00 (d6:1a:53:21:78:00), Dst: d6:1a:53:62:78:00 (d6:1a:53:62:78:00)
Internet Protocol Version 4, Src: 10.200.33.18, Dst: 4.232.99.1
Transmission Control Protocol, Src Port: 40942, Dst Port: 443, Seq: 470, Ack: 100, Len: 6
Transport Layer Security
    TLSv1.3 Record Layer: Change Cipher Spec Protocol: Change Cipher Spec
        Content Type: Change Cipher Spec (20)
        Version: TLS 1.2 (0x0303)
        Length: 1
        Change Cipher Spec Message

**msg3：**
Frame 1805: 636 bytes on wire (5088 bits), 636 bytes captured (5088 bits)
Ethernet II, Src: d6:1a:53:21:78:00 (d6:1a:53:21:78:00), Dst: d6:1a:53:62:78:00 (d6:1a:53:62:78:00)
Internet Protocol Version 4, Src: 10.200.33.18, Dst: 4.232.99.1
Transmission Control Protocol, Src Port: 40942, Dst Port: 443, Seq: 476, Ack: 100, Len: 570
Transport Layer Security
    TLSv1.3 Record Layer: Handshake Protocol: Client Hello
        Content Type: Handshake (22)
        Version: TLS 1.2 (0x0303)
        Length: 565
        Handshake Protocol: Client Hello
            Handshake Type: Client Hello (1)
            Length: 561
            Version: TLS 1.2 (0x0303)
            Random: 8f0021fc1d9c8fe5d96728286aa22a0bd91a37848a2e4c73e508ca9a37257f9c
            Session ID Length: 32
            Session ID: 7b5c94253134a6efc0120ce69c54074a49bc8d5bdb1dd4395584f1c1e263e47e
            Cipher Suites Length: 218
            Cipher Suites (109 suites)
            Compression Methods Length: 1
            Compression Methods (1 method)
            Extensions Length: 270
            Extension: server_name (len=33) name=************************.com
                Type: server_name (0)
                Length: 33
                Server Name Indication extension
            Extension: supported_versions (len=5) TLS 1.3, TLS 1.2
                Type: supported_versions (43)
                Length: 5
                Supported Versions length: 4
                Supported Version: TLS 1.3 (0x0304)
                Supported Version: TLS 1.2 (0x0303)
            Extension: key_share (len=139) secp521r1
                Type: key_share (51)
                Length: 139
                Key Share extension
                    Client Key Share Length: 137
                    Key Share Entry: Group: secp521r1, Key Exchange length: 133
            Extension: psk_key_exchange_modes (len=3)
                Type: psk_key_exchange_modes (45)
                Length: 3
                PSK Key Exchange Modes Length: 2
                PSK Key Exchange Mode: PSK with (EC)DHE key establishment (psk_dhe_ke) (1)
                PSK Key Exchange Mode: PSK-only key establishment (psk_ke) (0)
            Extension: supported_groups (len=28)
                Type: supported_groups (10)
                Length: 28
                Supported Groups List Length: 26
                Supported Groups (13 groups)
                    Supported Group: x25519 (0x001d)
                    Supported Group: secp256r1 (0x0017)
                    Supported Group: secp384r1 (0x0018)
                    Supported Group: x448 (0x001e)
                    Supported Group: secp521r1 (0x0019)
                    Supported Group: brainpoolP256r1 (0x001a)
                    Supported Group: brainpoolP384r1 (0x001b)
                    Supported Group: brainpoolP512r1 (0x001c)
                    Supported Group: ffdhe2048 (0x0100)
                    Supported Group: ffdhe3072 (0x0101)
                    Supported Group: ffdhe4096 (0x0102)
                    Supported Group: ffdhe6144 (0x0103)
                    Supported Group: ffdhe8192 (0x0104)
            Extension: signature_algorithms (len=20)
                Type: signature_algorithms (13)
                Length: 20
                Signature Hash Algorithms Length: 18
                Signature Hash Algorithms (9 algorithms)
            Extension: ec_point_formats (len=2)
                Type: ec_point_formats (11)
                Length: 2
                EC point formats Length: 1
                Elliptic curves point formats (1)
            Extension: encrypt_then_mac (len=0)
                Type: encrypt_then_mac (22)
                Length: 0
            Extension: extended_master_secret (len=0)
                Type: extended_master_secret (23)
                Length: 0
            Extension: session_ticket (len=0)
                Type: session_ticket (35)
                Length: 0
                Session Ticket: <MISSING>
            [JA4: t13d991000_85781606486d_6e561896c42d]
            [JA4_r [truncated]: t13d991000_002f,0033,0035,0039,003c,003d,0041,0045,0067,006b,0084,0088,009c,009d,009e,009f,00ba,00be,00c0,00c4,00ff,1301,1302,1303,1304,1305,c004,c005,c009,c00a,c00e,c00f,c013,c014,c023,c024,c025,c026,c027,c028,c029,c02a]
            [JA3 Fullstring [truncated]: 771,4867-4866-4865-4868-4869-52392-52393-52394-49196-49200-159-49325-49311-49188-49192-107-49162-49172-57-49327-49315-49287-49291-49277-49267-49271-196-136-49245-49249-49235-49225-49229-49221-49195-49199-158-493]
            [JA3: 2aee253f8c386527d262c76c37e0fac0]
Frame 1616: 165 bytes on wire (1320 bits), 165 bytes captured (1320 bits)
Ethernet II, Src: d6:1a:53:62:78:00 (d6:1a:53:62:78:00), Dst: d6:1a:53:21:78:00 (d6:1a:53:21:78:00)
Internet Protocol Version 4, Src: 4.232.99.1, Dst: 10.200.33.18
Transmission Control Protocol, Src Port: 443, Dst Port: 40942, Seq: 1, Ack: 470, Len: 99
Transport Layer Security
    TLSv1.3 Record Layer: Handshake Protocol: Hello Retry Request
        Content Type: Handshake (22)
        Version: TLS 1.2 (0x0303)
        Length: 88
        Handshake Protocol: Hello Retry Request
            Handshake Type: Server Hello (2)
            Length: 84
            Version: TLS 1.2 (0x0303)
            Random: cf21ad74e59a6111be1d8c021e65b891c2a211167abb8c5e079e09e2c8a8339c (HelloRetryRequest magic)
            Session ID Length: 32
            Session ID: 7b5c94253134a6efc0120ce69c54074a49bc8d5bdb1dd4395584f1c1e263e47e
            Cipher Suite: TLS_AES_256_GCM_SHA384 (0x1302)
            Compression Method: null (0)
            Extensions Length: 12
            Extension: supported_versions (len=2) TLS 1.3
                Type: supported_versions (43)
                Length: 2
                Supported Version: TLS 1.3 (0x0304)
            Extension: key_share (len=2) secp521r1
                Type: key_share (51)
                Length: 2
                Key Share extension
                    Selected Group: secp521r1 (25)
            [JA3S Fullstring: 771,4866,43-51]
            [JA3S: 15af977ce25de452b96affa2addb1036]
    TLSv1.3 Record Layer: Change Cipher Spec Protocol: Change Cipher Spec
        Content Type: Change Cipher Spec (20)
        Version: TLS 1.2 (0x0303)
        Length: 1
        Change Cipher Spec Message
**msg 4**
Frame 1897: 73 bytes on wire (584 bits), 73 bytes captured (584 bits)
Ethernet II, Src: d6:1a:53:62:78:00 (d6:1a:53:62:78:00), Dst: d6:1a:53:21:78:00 (d6:1a:53:21:78:00)
Internet Protocol Version 4, Src: 4.232.99.1, Dst: 10.200.33.18
Transmission Control Protocol, Src Port: 443, Dst Port: 40942, Seq: 100, Ack: 1046, Len: 7
Transport Layer Security
    TLSv1.3 Record Layer: Alert (Level: Fatal, Description: Protocol Version)
        Content Type: Alert (21)
        Version: TLS 1.2 (0x0303)
        Length: 2
        Alert Message
            Level: Fatal (2)
            Description: Protocol Version (70)

### System information

Mbed TLS version (number or commit id): 3.5.1
Operating system and version: Linux 5.10.198
Configuration (if not default, please attach `mbedtls_config.h`): 
Compiler and options (if you used a pre-built binary, please indicate how you obtained it): 
Additional environment information: 

### Expected behavior
succeed to finish handshake

### Actual behavior
handshake fail with "Alert (Level: Fatal, Description: Protocol Version)"

### Additional information
The server name can be sent in a private email if needed.

Chrome works well on the same server. 
The msg flow is:
**msg 2.1**
Frame 2727: 519 bytes on wire (4152 bits), 519 bytes captured (4152 bits) on interface \Device\NPF_{913CAB76-6E85-4E82-B09D-CE8DAA3D1632}, id 0
Ethernet II, Src: CloudNetwork_ba:59:85 (f8:89:d2:ba:59:85), Dst: NewH3CTechno_b4:dc:01 (98:a9:2d:b4:dc:01)
Internet Protocol Version 4, Src: 10.239.61.34, Dst: 20.111.1.9
Transmission Control Protocol, Src Port: 61234, Dst Port: 443, Seq: 1433, Ack: 1, Len: 465
[2 Reassembled TCP Segments (1897 bytes): #2726(1432), #2727(465)]
Transport Layer Security
    TLSv1.3 Record Layer: Handshake Protocol: Client Hello
        Content Type: Handshake (22)
        Version: TLS 1.0 (0x0301)
        Length: 1892
        Handshake Protocol: Client Hello
            Handshake Type: Client Hello (1)
            Length: 1888
            Version: TLS 1.2 (0x0303)
            Random: 155e8ea2dfc738c9a3df544072f94e7459053d2f79c09837d03a0ce3a69caca4
            Session ID Length: 32
            Session ID: e94e4afdc9dc13dba5e877c612780559c36ba05d62ab7bceabd24e1652fd6132
            Cipher Suites Length: 32
            Cipher Suites (16 suites)
            Compression Methods Length: 1
            Compression Methods (1 method)
            Extensions Length: 1783
            Extension: Reserved (GREASE) (len=0)
            Extension: server_name (len=33) name=**********************************.com
            Extension: signed_certificate_timestamp (len=0)
            Extension: ec_point_formats (len=2)
            Extension: encrypted_client_hello (len=250)
            Extension: supported_versions (len=7) TLS 1.3, TLS 1.2
            Extension: renegotiation_info (len=1)
            Extension: Unknown type 17613 (len=5)
            Extension: signature_algorithms (len=18)
            Extension: supported_groups (len=12)
            Extension: psk_key_exchange_modes (len=2)
            Extension: extended_master_secret (len=0)
            Extension: application_layer_protocol_negotiation (len=14)
            Extension: session_ticket (len=0)
            Extension: key_share (len=1263) Unknown (4588), x25519
            Extension: status_request (len=5)
            Extension: compress_certificate (len=3)
            Extension: Reserved (GREASE) (len=1)
            Extension: pre_shared_key (len=91)
            [JA4: t13d1517h2_8daaf6152771_b6f405a00624]
            [JA4_r: t13d1517h2_002f,0035,009c,009d,1301,1302,1303,c013,c014,c02b,c02c,c02f,c030,cca8,cca9_0005,000a,000b,000d,0012,0017,001b,0023,0029,002b,002d,0033,44cd,fe0d,ff01_0403,0804,0401,0503,0805,0501,0806,0601]
            [JA3 Fullstring: 771,4865-4866-4867-49195-49199-49196-49200-52393-52392-49171-49172-156-157-47-53,0-18-11-65037-43-65281-17613-13-10-45-23-16-35-51-5-27-41,4588-29-23-24,0]
            [JA3: 6fa81e062c6df208878651292c893598]
**msg 2.2**
Frame 2743: 153 bytes on wire (1224 bits), 153 bytes captured (1224 bits) on interface \Device\NPF_{913CAB76-6E85-4E82-B09D-CE8DAA3D1632}, id 0
Ethernet II, Src: NewH3CTechno_b4:dc:01 (98:a9:2d:b4:dc:01), Dst: CloudNetwork_ba:59:85 (f8:89:d2:ba:59:85)
Internet Protocol Version 4, Src: 20.111.1.9, Dst: 10.239.61.34
Transmission Control Protocol, Src Port: 443, Dst Port: 61234, Seq: 1, Ack: 1898, Len: 99
Transport Layer Security
    TLSv1.3 Record Layer: Handshake Protocol: Hello Retry Request
        Content Type: Handshake (22)
        Version: TLS 1.2 (0x0303)
        Length: 88
        Handshake Protocol: Hello Retry Request
            Handshake Type: Server Hello (2)
            Length: 84
            Version: TLS 1.2 (0x0303)
            Random: cf21ad74e59a6111be1d8c021e65b891c2a211167abb8c5e079e09e2c8a8339c (HelloRetryRequest magic)
            Session ID Length: 32
            Session ID: e94e4afdc9dc13dba5e877c612780559c36ba05d62ab7bceabd24e1652fd6132
            Cipher Suite: TLS_AES_256_GCM_SHA384 (0x1302)
            Compression Method: null (0)
            Extensions Length: 12
            Extension: supported_versions (len=2) TLS 1.3
            Extension: key_share (len=2) secp384r1
            [JA3S Fullstring: 771,4866,43-51]
            [JA3S: 15af977ce25de452b96affa2addb1036]
    TLSv1.3 Record Layer: Change Cipher Spec Protocol: Change Cipher Spec
        Content Type: Change Cipher Spec (20)
        Version: TLS 1.2 (0x0303)
        Length: 1
        Change Cipher Spec Message

**msg 2.3**
Frame 2744: 797 bytes on wire (6376 bits), 797 bytes captured (6376 bits) on interface \Device\NPF_{913CAB76-6E85-4E82-B09D-CE8DAA3D1632}, id 0
Ethernet II, Src: CloudNetwork_ba:59:85 (f8:89:d2:ba:59:85), Dst: NewH3CTechno_b4:dc:01 (98:a9:2d:b4:dc:01)
Internet Protocol Version 4, Src: 10.239.61.34, Dst: 20.111.1.9
Transmission Control Protocol, Src Port: 61234, Dst Port: 443, Seq: 1898, Ack: 100, Len: 743
Transport Layer Security
    TLSv1.3 Record Layer: Change Cipher Spec Protocol: Change Cipher Spec
        Content Type: Change Cipher Spec (20)
        Version: TLS 1.2 (0x0303)
        Length: 1
        Change Cipher Spec Message
    TLSv1.3 Record Layer: Handshake Protocol: Client Hello
        Content Type: Handshake (22)
        Version: TLS 1.2 (0x0303)
        Length: 732
        Handshake Protocol: Client Hello
            Handshake Type: Client Hello (1)
            Length: 728
            Version: TLS 1.2 (0x0303)
            Random: 155e8ea2dfc738c9a3df544072f94e7459053d2f79c09837d03a0ce3a69caca4
            Session ID Length: 32
            Session ID: e94e4afdc9dc13dba5e877c612780559c36ba05d62ab7bceabd24e1652fd6132
            Cipher Suites Length: 32
            Cipher Suites (16 suites)
            Compression Methods Length: 1
            Compression Methods (1 method)
            Extensions Length: 623
            Extension: Reserved (GREASE) (len=0)
            Extension: server_name (len=33) name=acc.connect.cpms.milence.com
            Extension: signed_certificate_timestamp (len=0)
            Extension: ec_point_formats (len=2)
            Extension: encrypted_client_hello (len=250)
            Extension: supported_versions (len=7) TLS 1.3, TLS 1.2
            Extension: renegotiation_info (len=1)
            Extension: Unknown type 17613 (len=5)
            Extension: signature_algorithms (len=18)
            Extension: supported_groups (len=12)
            Extension: psk_key_exchange_modes (len=2)
            Extension: extended_master_secret (len=0)
            Extension: application_layer_protocol_negotiation (len=14)
            Extension: session_ticket (len=0)
            Extension: key_share (len=103) secp384r1
            Extension: status_request (len=5)
            Extension: compress_certificate (len=3)
            Extension: Reserved (GREASE) (len=1)
            Extension: pre_shared_key (len=91)
            [JA4: t13d1517h2_8daaf6152771_b6f405a00624]
            [JA4_r: t13d1517h2_002f,0035,009c,009d,1301,1302,1303,c013,c014,c02b,c02c,c02f,c030,cca8,cca9_0005,000a,000b,000d,0012,0017,001b,0023,0029,002b,002d,0033,44cd,fe0d,ff01_0403,0804,0401,0503,0805,0501,0806,0601]
            [JA3 Fullstring: 771,4865-4866-4867-49195-49199-49196-49200-52393-52392-49171-49172-156-157-47-53,0-18-11-65037-43-65281-17613-13-10-45-23-16-35-51-5-27-41,4588-29-23-24,0]
            [JA3: 6fa81e062c6df208878651292c893598]

**msg 2.4**
Frame 2766: 1486 bytes on wire (11888 bits), 1486 bytes captured (11888 bits) on interface \Device\NPF_{913CAB76-6E85-4E82-B09D-CE8DAA3D1632}, id 0
Ethernet II, Src: NewH3CTechno_b4:dc:01 (98:a9:2d:b4:dc:01), Dst: CloudNetwork_ba:59:85 (f8:89:d2:ba:59:85)
Internet Protocol Version 4, Src: 20.111.1.9, Dst: 10.239.61.34
Transmission Control Protocol, Src Port: 443, Dst Port: 61234, Seq: 100, Ack: 2641, Len: 1432
Transport Layer Security
    TLSv1.3 Record Layer: Handshake Protocol: Server Hello
        Content Type: Handshake (22)
        Version: TLS 1.2 (0x0303)
        Length: 187
        Handshake Protocol: Server Hello
            Handshake Type: Server Hello (2)
            Length: 183
            Version: TLS 1.2 (0x0303)
            Random: 522ef36ec2827bf6677b7247e7dea304ececb8dde5138d069f2376c92fd8fd63
            Session ID Length: 32
            Session ID: e94e4afdc9dc13dba5e877c612780559c36ba05d62ab7bceabd24e1652fd6132
            Cipher Suite: TLS_AES_256_GCM_SHA384 (0x1302)
            Compression Method: null (0)
            Extensions Length: 111
            Extension: supported_versions (len=2) TLS 1.3
            Extension: key_share (len=101) secp384r1
            [JA3S Fullstring: 771,4866,43-51]
            [JA3S: 15af977ce25de452b96affa2addb1036]
    TLS segment data (1240 bytes)

**Comment by minosgalanakis** [comment]
Hi, thanks for your report.

To investigate this further, we’ll need some additional details, including:

-   The TLS stack and configuration used on the server side
-    The Mbed TLS version configuration options you’re using
-    A minimal example or steps to reproduce the issue

For support requests like this, we recommend using the public mailing list: mbed-tls@lists.trustedfirmware.org. 

I’ll go ahead and close this issue here, but I’d be happy to continue the discussion on the mailing list, where others can also follow and contribute.
